{
  "schema": "cap.core.policy_decision.v1",
  "id": "policy-decision.local-analysis-001",
  "policyBinding": "binding.policy.no-network",
  "policySystem": "host-policy",
  "policyRef": "policy://fixture/no-network",
  "policyVersion": "2026-07-05-fixture",
  "principal": "user:fixture",
  "action": "run",
  "resource": "assembly.local-analysis-001",
  "decision": "allowed_with_constraints",
  "decisionTime": "2026-07-05T12:00:00Z",
  "conditions": {
    "network": "disabled",
    "writeScope": "file://workspace/out/",
    "timeout": "10m"
  },
  "obligations": [
    "record-run-evidence",
    "do-not-store-secret-values",
    "render-digest-view-after-finalize"
  ],
  "auditRef": "audit://fixture/local-analysis-001"
}
